[2025-11-15 00:44:12] Scheduled optimization for workload: general
[2025-11-15 00:44:12] Starting optimization for general workload
[2025-11-15 00:44:12] Workload change detected: general -> compilation
[2025-11-15 00:44:12] Strategy: adaptive, Budget: 10
[2025-11-15 00:44:12] Created parameter backup: /tmp/kernel_optimizer_backup/kernel_params_backup_1763147652.json
[2025-11-15 00:44:27] Optimization already in progress, skipping compilation
[2025-11-15 00:45:11] Applying optimized parameters: {'vm.swappiness': 62.969759652358455, 'vm.dirty_ratio': 13.01282391232251, 'kernel.sched_cfs_bandwidth_slice_us': 3306.9532133287034}
[2025-11-15 00:45:11] All parameters applied successfully
[2025-11-15 00:45:12] Process priority optimization: {'processes_adjusted': 51, 'high_priority_set': 51, 'low_priority_set': 0, 'errors': 0, 'short_lived_filtered': 0, 'processes_tracked': 0}
[2025-11-15 00:45:12] Optimization completed in 59.16s
[2025-11-15 00:45:12] Best score: 46.382257
[2025-11-15 00:45:12] Total evaluations: 5
[2025-11-15 00:45:35] Scheduled optimization for workload: general
[2025-11-15 00:45:35] Starting optimization for general workload
[2025-11-15 00:45:35] Strategy: adaptive, Budget: 10
[2025-11-15 00:45:35] Workload change detected: general -> compilation
[2025-11-15 00:45:35] Created parameter backup: /tmp/kernel_optimizer_backup/kernel_params_backup_1763147735.json
[2025-11-15 00:45:49] Optimization already in progress, skipping compilation
[2025-11-15 00:46:34] Applying optimized parameters: {'vm.swappiness': 65.75800908021631, 'vm.dirty_ratio': 13.668695797323277, 'kernel.sched_cfs_bandwidth_slice_us': 3339.0730008183086}
[2025-11-15 00:46:34] All parameters applied successfully
[2025-11-15 00:46:34] Process priority optimization: {'processes_adjusted': 0, 'high_priority_set': 0, 'low_priority_set': 0, 'errors': 0, 'short_lived_filtered': 0, 'processes_tracked': 0}
[2025-11-15 00:46:34] Optimization completed in 58.92s
[2025-11-15 00:46:34] Best score: 47.531507
[2025-11-15 00:46:34] Total evaluations: 5
[2025-11-15 01:51:43] Scheduled optimization for workload: general
[2025-11-15 01:51:43] Starting optimization for general workload
[2025-11-15 01:51:43] Strategy: adaptive, Budget: 10
[2025-11-15 01:51:43] Created parameter backup: /tmp/kernel_optimizer_backup/kernel_params_backup_1763151703.json
[2025-11-15 01:51:43] Workload change detected: general -> compilation
[2025-11-15 01:51:57] Optimization already in progress, skipping compilation
[2025-11-15 01:52:42] Applying optimized parameters: {'vm.swappiness': 10.0, 'vm.dirty_ratio': 30.0, 'kernel.sched_cfs_bandwidth_slice_us': 1000.0}
[2025-11-15 01:52:42] All parameters applied successfully
[2025-11-15 01:52:42] Process priority optimization: {'processes_adjusted': 0, 'high_priority_set': 0, 'low_priority_set': 0, 'errors': 0, 'short_lived_filtered': 0, 'processes_tracked': 0}
[2025-11-15 01:52:42] Optimization completed in 59.19s
[2025-11-15 01:52:42] Best score: 56.105083
[2025-11-15 01:52:42] Total evaluations: 5
[2025-11-15 02:22:57] Starting optimization for general workload
[2025-11-15 02:22:57] Scheduled optimization for workload: general
[2025-11-15 02:22:57] Strategy: adaptive, Budget: 10
[2025-11-15 02:22:57] Created parameter backup: /tmp/kernel_optimizer_backup/kernel_params_backup_1763153577.json
[2025-11-15 02:22:57] Workload change detected: general -> compilation
[2025-11-15 02:23:12] Optimization already in progress, skipping compilation
[2025-11-15 02:23:57] Applying optimized parameters: {'vm.swappiness': 10.0, 'vm.dirty_ratio': 30.0, 'kernel.sched_cfs_bandwidth_slice_us': 1000.0}
[2025-11-15 02:23:57] All parameters applied successfully
[2025-11-15 02:23:57] Process priority optimization: {'processes_adjusted': 0, 'high_priority_set': 0, 'low_priority_set': 0, 'errors': 0, 'short_lived_filtered': 0, 'processes_tracked': 0}
[2025-11-15 02:23:57] Optimization completed in 59.49s
[2025-11-15 02:23:57] Best score: 49.782015
[2025-11-15 02:23:57] Total evaluations: 5
[2025-11-15 02:26:28] Workload change detected: compilation -> general
[2025-11-15 02:26:35] Workload change detected: general -> io_intensive
[2025-11-15 02:26:43] Scheduled optimization for workload: general
[2025-11-15 02:26:43] Starting optimization for general workload
[2025-11-15 02:26:44] Strategy: adaptive, Budget: 10
[2025-11-15 02:26:50] Optimization already in progress, skipping io_intensive
[2025-11-15 02:26:48] Created parameter backup: /tmp/kernel_optimizer_backup/kernel_params_backup_1763153808.json
[2025-11-15 02:27:28] Workload change detected: io_intensive -> compilation
[2025-11-15 02:27:43] Optimization already in progress, skipping compilation
[2025-11-15 02:27:56] Applying optimized parameters: {'vm.swappiness': 65.75800908021631, 'vm.dirty_ratio': 13.668695797323277, 'kernel.sched_cfs_bandwidth_slice_us': 3339.0730008183086}
[2025-11-15 02:27:56] All parameters applied successfully
[2025-11-15 02:27:56] Process priority optimization: {'processes_adjusted': 0, 'high_priority_set': 0, 'low_priority_set': 0, 'errors': 0, 'short_lived_filtered': 0, 'processes_tracked': 0}
[2025-11-15 02:27:56] Optimization completed in 72.51s
[2025-11-15 02:27:56] Best score: 64.383453
[2025-11-15 02:27:56] Total evaluations: 5
